Company,Valuation,  Valuation $  ,Date Joined,Industry,City,Country,Continent,Year Founded,Funding,  Funding $  ,Select Investors
Bytedance,$180B,"  $180,000,000,000  ",07/04/2017,Artificial intelligence,Beijing,China,Asia,2012,$8B,"  $8,000,000,000  ","Sequoia Capital China, SIG Asia Investments, Sina Weibo, Softbank Group"
SpaceX,$100B,"  $100,000,000,000  ",01/12/2012,Other,Hawthorne,United States,North America,2002,$7B,"  $7,000,000,000  ","Founders Fund, Draper Fisher Jurvetson, Rothenberg Ventures"
SHEIN,$100B,"  $100,000,000,000  ",03/07/2018,E-commerce & direct-to-consumer,Shenzhen,China,Asia,2008,$2B,"  $2,000,000,000  ","Tiger Global Management, Sequoia Capital China, Shunwei Capital Partners"
Stripe,$95B,"  $95,000,000,000  ",23/01/2014,Fintech,San Francisco,United States,North America,2010,$2B,"  $2,000,000,000  ","Khosla Ventures, LowercaseCapital, capitalG"
Klarna,$46B,"  $46,000,000,000  ",12/12/2011,Fintech,Stockholm,Sweden,Europe,2005,$4B,"  $4,000,000,000  ","Institutional Venture Partners, Sequoia Capital, General Atlantic"
Canva,$40B,"  $40,000,000,000  ",08/01/2018,Internet software & services,Surry Hills,Australia,Oceania,2012,$572M,"  $572,000,000  ","Sequoia Capital China, Blackbird Ventures, Matrix Partners"
Checkout.com,$40B,"  $40,000,000,000  ",02/05/2019,Fintech,London,United Kingdom,Europe,2012,$2B,"  $2,000,000,000  ","Tiger Global Management, Insight Partners, DST Global"
Instacart,$39B,"  $39,000,000,000  ",30/12/2014,"Supply chain, logistics, & delivery",San Francisco,United States,North America,2012,$3B,"  $3,000,000,000  ","Khosla Ventures, Kleiner Perkins Caufield & Byers, Collaborative Fund"
JUUL Labs,$38B,"  $38,000,000,000  ",20/12/2017,Consumer & retail,San Francisco,United States,North America,2015,$14B,"  $14,000,000,000  ",Tiger Global Management
Databricks,$38B,"  $38,000,000,000  ",05/02/2019,Data management & analytics,San Francisco,United States,North America,2013,$3B,"  $3,000,000,000  ","Andreessen Horowitz, New Enterprise Associates, Battery Ventures"
Revolut,$33B,"  $33,000,000,000  ",26/04/2018,Fintech,London,United Kingdom,Europe,2015,$2B,"  $2,000,000,000  ","index Ventures, DST Global, Ribbit Capital"
Epic Games,$32B,"  $32,000,000,000  ",26/10/2018,Other,Cary,United States,North America,1991,$7B,"  $7,000,000,000  ","Tencent Holdings, KKR, Smash Ventures"
FTX,$32B,"  $32,000,000,000  ",20/07/2021,Fintech,Nassau,Bahamas,North America,2018,$2B,"  $2,000,000,000  ","Sequoia Capital, Thoma Bravo, Softbank"
Fanatics,$27B,"  $27,000,000,000  ",06/06/2012,E-commerce & direct-to-consumer,Jacksonville,United States,North America,2002,$4B,"  $4,000,000,000  ","SoftBank Group, Andreessen Horowitz, Temasek Holdings"
Chime,$25B,"  $25,000,000,000  ",05/03/2019,Fintech,San Francisco,United States,North America,2013,$2B,"  $2,000,000,000  ","Forerunner Ventures, Crosslink Capital, Homebrew"
BYJU's,$22B,"  $22,000,000,000  ",25/07/2017,Edtech,Bengaluru,India,Asia,2008,$4B,"  $4,000,000,000  ","Tencent Holdings, Lightspeed India Partners, Sequoia Capital India"
J&T Express,$20B,"  $20,000,000,000  ",07/04/2021,"Supply chain, logistics, & delivery",Jakarta,Indonesia,Asia,2015,$5B,"  $5,000,000,000  ","Hillhouse Capital Management, Boyu Capital, Sequoia Capital China"
Xiaohongshu,$20B,"  $20,000,000,000  ",31/03/2016,E-commerce & direct-to-consumer,Shanghai,China,Asia,2013,$918M,"  $918,000,000  ","GGV Capital, ZhenFund, Tencent"
Miro,$18B,"  $18,000,000,000  ",05/01/2022,Internet software & services,San Francisco,United States,North America,2011,$476M,"  $476,000,000  ","Accel, AltaIR Capital, Technology Crossover Ventures"
Yuanfudao,$17B,"  $17,000,000,000  ",31/05/2017,Edtech,Beijing,China,Asia,2012,$4B,"  $4,000,000,000  ","Tencent Holdings, Warbug Pincus, IDG Capital"
Rapyd,$15B,"  $15,000,000,000  ",03/12/2019,Fintech,London,United Kingdom,Europe,2016,$770M,"  $770,000,000  ","Target Global, General Catalyst, Durable Capital Partners"
Discord,$15B,"  $15,000,000,000  ",20/04/2018,Internet software & services,San Francisco,United States,North America,2012,$979M,"  $979,000,000  ","Benchmark, Greylock Partners, Tencent Holdings"
Genki Forest,$15B,"  $15,000,000,000  ",01/03/2020,Consumer & retail,Beijing,China,Asia,2016,$721M,"  $721,000,000  ","Sequoia Capital China, Longfor Capitalm, Gaorong Capital"
goPuff,$15B,"  $15,000,000,000  ",08/10/2020,E-commerce & direct-to-consumer,Philadelphia,United States,North America,2013,$3B,"  $3,000,000,000  ","Accel, Softbank Group, Anthos Capital"
Blockchain.com,$14B,"  $14,000,000,000  ",17/02/2021,Fintech,London,United Kingdom,Europe,2011,$490M,"  $490,000,000  ","Lightspeed Venture Partners, Google Ventures, Lakestar"
Plaid,$13B,"  $13,000,000,000  ",11/12/2018,Fintech,San Francisco,United States,North America,2012,$734M,"  $734,000,000  ","New Enterprise Associates, Spar Capital, Index Ventures"
Devoted Health,$13B,"  $13,000,000,000  ",16/10/2018,Health,Waltham,United States,North America,2017,$2B,"  $2,000,000,000  ","Andreessen Horowitz, F-Prime Capital, Venrock"
OpenSea,$13B,"  $13,000,000,000  ",20/07/2021,E-commerce & direct-to-consumer,New York,United States,North America,2017,$427M,"  $427,000,000  ","Andreessen Horowitz, Thirty Five Ventures, Sound Ventures"
Grammarly,$13B,"  $13,000,000,000  ",10/10/2019,Internet software & services,San Francisco,United States,North America,2009,$400M,"  $400,000,000  ","General Catalyst, Institutional Venture Partners, Breyer Capital"
Argo AI,$12B,"  $12,000,000,000  ",12/07/2019,Artificial intelligence,Pittsburgh,United States,North America,2016,$4B,"  $4,000,000,000  ","Volkswagen Group, Ford Autonomous Vehicles"
Northvolt,$12B,"  $12,000,000,000  ",12/06/2019,Other,Stockholm,Sweden,Europe,2016,$4B,"  $4,000,000,000  ","Vattenfall, Volkswagen Group, Goldman Sachs"
Faire,$12B,"  $12,000,000,000  ",30/10/2019,Artificial intelligence,San Francisco,United States,North America,2017,$1B,"  $1,000,000,000  ","Khosla Ventures, Forerunner Ventures, Sequoia Capital"
Airtable,$12B,"  $12,000,000,000  ",15/11/2018,Internet software & services,San Francisco,United States,North America,2013,$1B,"  $1,000,000,000  ","Caffeinated Capital, CRV, Founder Collective"
Brex,$12B,"  $12,000,000,000  ",05/10/2018,Fintech,San Francisco,United States,North America,2017,$1B,"  $1,000,000,000  ","DST Global, Ribbit Capital, Greenoaks Capital Management"
Getir,$12B,"  $12,000,000,000  ",26/03/2021,E-commerce & direct-to-consumer,Istanbul,Turkey,Europe,2015,$2B,"  $2,000,000,000  ","Tiger Global Management, Sequoia Capital, Revo Capital"
Biosplice Therapeutics,$12B,"  $12,000,000,000  ",06/08/2018,Health,San Diego,United States,North America,2008,$799M,"  $799,000,000  ","Vickers Venture Partners, IKEA GreenTech"
Bitmain,$12B,"  $12,000,000,000  ",06/07/2018,Hardware,Beijing,China,Asia,2015,$765M,"  $765,000,000  ","Coatue Management, Sequoia Capital China, IDG Capital"
GoodLeap,$12B,"  $12,000,000,000  ",13/10/2021,Internet software & services,Roseville,United States,North America,2003,$800M,"  $800,000,000  ","New Enterprise Associates, BDT Capital Partners, Davidson Kempner Capital Management"
Xingsheng Selected,$12B,"  $12,000,000,000  ",22/07/2020,E-commerce & direct-to-consumer,Changsha,China,Asia,2009,$5B,"  $5,000,000,000  ","KKR, Tencent Holdings, Sequoia Capital China"
ZongMu Technology,$11B,"  $11,000,000,000  ",03/06/2021,Auto & transportation,Shanghai,China,Asia,2013,$376M,"  $376,000,000  ","LTW Capital, Legend Capital, Qualcomm Ventures"
Bolt,$11B,"  $11,000,000,000  ",29/05/2018,Auto & transportation,Tallinn,Estonia,Europe,2013,$1B,"  $1,000,000,000  ","Didi Chuxing, Diamler, TMT Investments"
Swiggy,$11B,"  $11,000,000,000  ",21/06/2018,"Supply chain, logistics, & delivery",Bengaluru,India,Asia,2014,$5B,"  $5,000,000,000  ","Accel India, SAIF Partners, Norwest Venture Partners"
Weilong Foods,$11B,"  $11,000,000,000  ",08/05/2021,Consumer & retail,Luohe,China,Asia,1999,$558M,"  $558,000,000  ","Tencent Holdings, Hillhouse Capital Management, Yunfeng Capital"
Global Switch,$11B,"  $11,000,000,000  ",22/12/2016,Hardware,London,United Kingdom,Europe,1998,$5B,"  $5,000,000,000  ","Aviation Industry Corporation of China, Essence Financial, Jiangsu Sha Steel Group"
Bolt,$11B,"  $11,000,000,000  ",08/10/2021,Fintech,San Francisco,United States,North America,2014,$1B,"  $1,000,000,000  ","Activant Capital, Tribe Capital, General Atlantic"
Celonis,$11B,"  $11,000,000,000  ",26/06/2018,Data management & analytics,Munich,Germany,Europe,2011,$1B,"  $1,000,000,000  ","Accel, 83North"
Zuoyebang,$10B,"  $10,000,000,000  ",18/07/2018,Edtech,Beijing,China,Asia,2014,$3B,"  $3,000,000,000  ","Sequoia Capital China, Xiang He Capital, GGV Capital"
Ripple,$10B,"  $10,000,000,000  ",20/12/2019,Fintech,San Francisco,United States,North America,2012,$294M,"  $294,000,000  ","IDG Capital, Venture51, Lightspeed Venture Partners"
OYO Rooms,$10B,"  $10,000,000,000  ",25/09/2018,Travel,Gurugram,India,Asia,2012,$3B,"  $3,000,000,000  ","SoftBank Group, Sequoia Capital India,Lightspeed India Partners"
OutSystems,$10B,"  $10,000,000,000  ",05/06/2018,Internet software & services,Boston,United States,North America,2001,$572M,"  $572,000,000  ","KKR, ES Ventures, North Bridge Growth Equity"
ServiceTitan,$10B,"  $10,000,000,000  ",14/11/2018,Internet software & services,Glendale,United States,North America,2012,$1B,"  $1,000,000,000  ","Bessemer Venture Partners, ICONIQ Capital, Battery Ventures"
Alchemy,$10B,"  $10,000,000,000  ",28/10/2021,Fintech,San Francisco,United States,North America,2017,$564M,"  $564,000,000  ","DFJ Growth Fund, Coatue Management, Addition"
Chehaoduo,$10B,"  $10,000,000,000  ",12/03/2016,E-commerce & direct-to-consumer,Beijing,China,Asia,2015,$4B,"  $4,000,000,000  ","Sequoia Capital China, GX Capital"
Digital Currency Group,$10B,"  $10,000,000,000  ",01/11/2021,Fintech,New York,United States,North America,2015,$1B,"  $1,000,000,000  ","Ribbit Capital, capitalG, Softbank Group"
Figma,$10B,"  $10,000,000,000  ",30/04/2020,Internet software & services,San Francisco,United States,North America,2012,$333M,"  $333,000,000  ","Index Ventures, Greylock Partners, Kleiner Perkins Caufield & Byers"
Gusto,$10B,"  $10,000,000,000  ",18/12/2015,Fintech,San Francisco,United States,North America,2011,$691M,"  $691,000,000  ","General Catalyst Partners, Google Ventures, Kleiner Perkins Caufield & Byers"
Lalamove,$10B,"  $10,000,000,000  ",21/02/2019,"Supply chain, logistics, & delivery",Cheung Sha Wan,Hong Kong,Asia,2013,$2B,"  $2,000,000,000  ","MindWorks Ventures, Shunwei Capital Partners, Xiang He Capital"
Notion Labs,$10B,"  $10,000,000,000  ",01/04/2020,Internet software & services,San Francisco,United States,North America,2016,$343M,"  $343,000,000  ","Index Ventures, Draft Ventures, Felicis Ventures"
reddit,$10B,"  $10,000,000,000  ",31/07/2017,Internet software & services,San Francisco,United States,North America,2005,$1B,"  $1,000,000,000  ","Y Combinator, Sequoia Capital, Coatue Management"
Talkdesk,$10B,"  $10,000,000,000  ",03/10/2018,Internet software & services,San Francisco,United States,North America,2011,$497M,"  $497,000,000  ","DJF, Salesforce Ventures, Storm Ventures"
Thrasio,$10B,"  $10,000,000,000  ",15/07/2020,Other,Walpole,United States,North America,2018,$2B,"  $2,000,000,000  ","Upper90, RiverPark Ventures, Advent International"
Dunamu,$9B,"  $9,000,000,000  ",22/07/2021,Fintech,Seoul,South Korea,Asia,2012,$71M,"  $71,000,000  ","Qualcomm Ventures, Woori Investment, Hanwha Investment & Securities"
Yanolja,$9B,"  $9,000,000,000  ",10/06/2019,Travel,Seoul,South Korea,Asia,2005,$2B,"  $2,000,000,000  ","SBI Investment Korea, Partners Investment, GIC"
Pony.ai,$9B,"  $9,000,000,000  ",11/07/2018,Artificial intelligence,Fremont,United States,North America,2016,$1B,"  $1,000,000,000  ","Sequoia Capital China, IDG Capital, DCM Ventures"
Nuro,$9B,"  $9,000,000,000  ",11/02/2019,Auto & transportation,Mountain View,United States,North America,2016,$2B,"  $2,000,000,000  ","SoftBank Group, Greylock Partners, Gaorong Capital"
Snyk,$9B,"  $9,000,000,000  ",21/01/2020,Cybersecurity,Boston,United States,North America,2015,$1B,"  $1,000,000,000  ","BOLDstart Ventures, Google Ventures, Accel"
Kavak,$9B,"  $9,000,000,000  ",01/10/2020,E-commerce & direct-to-consumer,Lerma de Villada,Mexico,North America,2016,$2B,"  $2,000,000,000  ","DST Global, SoftBank Group, Mountain Nazca"
N26,$9B,"  $9,000,000,000  ",10/01/2019,Fintech,Berlin,Germany,Europe,2013,$2B,"  $2,000,000,000  ","Redalpine Venture Partners, Earlybird Venture Capital, Valar Ventures"
Klaviyo,$9B,"  $9,000,000,000  ",17/11/2020,Internet software & services,Boston,United States,North America,2012,$679M,"  $679,000,000  ","Summit Partners, Accel, Astral Capital"
Niantic,$9B,"  $9,000,000,000  ",24/11/2017,Mobile & telecommunications,San Francisco,United States,North America,2015,$770M,"  $770,000,000  ","Nintendo, Google, Pokemon Company International, Spark Capital"
Tanium,$9B,"  $9,000,000,000  ",31/03/2015,Cybersecurity,Kirkland,United States,North America,2007,$775M,"  $775,000,000  ","Andreessen Horowitz, Nor-Cal Invest, TPG Growth"
Dream11,$8B,"  $8,000,000,000  ",09/04/2019,Internet software & services,Mumbai,India,Asia,2007,$2B,"  $2,000,000,000  ","Kaalari Capital, Tencent Holdings, Steadview Capital"
DJI Innovations,$8B,"  $8,000,000,000  ",23/01/2015,Hardware,Shenzhen,China,Asia,2006,$105M,"  $105,000,000  ","Accel Partners, Sequoia Capital"
Netskope,$8B,"  $8,000,000,000  ",13/11/2018,Cybersecurity,Santa Clara,United States,North America,2012,$1B,"  $1,000,000,000  ","Lightspeed Venture Partners, Social Capital, Accel"
Razorpay,$8B,"  $8,000,000,000  ",11/10/2020,Fintech,Bengaluru,India,Asia,2013,$742M,"  $742,000,000  ","Sequoia Capital India, Tiger Global Management, Matrix Partners India"
Dapper Labs,$8B,"  $8,000,000,000  ",30/03/2021,Fintech,Vancouver,Canada,North America,2018,$607M,"  $607,000,000  ","Union Square Ventures, Venrock, Andreessen Horowitz"
Lacework,$8B,"  $8,000,000,000  ",07/01/2021,Cybersecurity,San Jose,United States,North America,2015,$2B,"  $2,000,000,000  ","Sutter Hill Ventures, Liberty Global Ventures, Coatue Management"
Tipalti,$8B,"  $8,000,000,000  ",06/10/2020,Fintech,San Mateo,United States,North America,2010,$549M,"  $549,000,000  ","01 Advisors, Zeev Ventures, Group 11"
Hopin,$8B,"  $8,000,000,000  ",10/11/2020,Internet software & services,London,United Kingdom,Europe,2019,$1B,"  $1,000,000,000  ","Accel, Northzone Ventures, Institutional Venture Partners"
Caris Life Sciences,$8B,"  $8,000,000,000  ",12/05/2021,Health,Irving,United States,North America,1996,$1B,"  $1,000,000,000  ","Sixth Street Partners, OrbiMed Advisors, Highland Capital Management"
Ramp,$8B,"  $8,000,000,000  ",29/03/2021,Fintech,New York,United States,North America,2019,$660M,"  $660,000,000  ","D1 Capital Partners, Stripe, Coatue Management"
Tempus,$8B,"  $8,000,000,000  ",21/03/2018,Health,Chicago,United States,North America,2015,$820M,"  $820,000,000  ","New Enterprise Associates, T. Rowe Associates, Lightbank"
Fireblocks,$8B,"  $8,000,000,000  ",27/07/2021,Fintech,New York,United States,North America,2018,$1B,"  $1,000,000,000  ","Tenaya Capital, Coatue Management, Stripes Group"
Flexport,$8B,"  $8,000,000,000  ",30/04/2018,"Supply chain, logistics, & delivery",San Francisco,United States,North America,2013,$2B,"  $2,000,000,000  ","Bloomberg Beta, Founders Fund, First Round Capital"
National Stock Exchange of India,$7B,"  $7,000,000,000  ",01/07/2020,Fintech,Mumbai,India,Asia,1998,$297M,"  $297,000,000  ","TA Associates, SoftBank Group, GS Growth"
Meicai,$7B,"  $7,000,000,000  ",22/06/2016,Mobile & telecommunications,Beijing,China,Asia,2014,$1B,"  $1,000,000,000  ","Tiger Global Management, Blue Lake Capital, ZhenFund"
Impossible Foods,$7B,"  $7,000,000,000  ",13/05/2019,Consumer & retail,Redwood City,United States,North America,2011,$2B,"  $2,000,000,000  ","Khosla Ventures, Horizons Ventures, Temasek Holdings"
CRED,$7B,"  $7,000,000,000  ",06/04/2021,Fintech,Bengaluru,India,Asia,2018,$922M,"  $922,000,000  ","Tiger Global Management, DST Global, Sequoia Capital India"
Attentive,$7B,"  $7,000,000,000  ",23/09/2020,Mobile & telecommunications,Hoboken,United States,North America,2016,$863M,"  $863,000,000  ","NextView Ventures, Eniac Ventures, Sequoia Capital"
Ola Cabs,$7B,"  $7,000,000,000  ",27/10/2014,Auto & transportation,Bengaluru,India,Asia,2010,$4B,"  $4,000,000,000  ","Accel Partners, SoftBank Group, Sequoia Capital"
Rippling,$7B,"  $7,000,000,000  ",04/08/2020,Internet software & services,San Francisco,United States,North America,2017,$447M,"  $447,000,000  ","Initialized Capital, Y Combinator, Kleiner Perkins Caufield & Byers"
Carta,$7B,"  $7,000,000,000  ",06/05/2019,Fintech,San Francisco,United States,North America,2012,$1B,"  $1,000,000,000  ","Menlo Ventures, Spark Capital, Union Square Ventures"
Toss,$7B,"  $7,000,000,000  ",09/12/2018,Fintech,Seoul,South Korea,Asia,2013,$844M,"  $844,000,000  ","Bessemer Venture Partners, Qualcomm Ventures, Kleiner Perkins Caufield & Byers"
Ziroom,$7B,"  $7,000,000,000  ",17/01/2018,E-commerce & direct-to-consumer,Beijing,China,Asia,2011,$2B,"  $2,000,000,000  ","Sequoia Capital China, Warburg Pincus, General Catalyst"
Scale AI,$7B,"  $7,000,000,000  ",05/08/2019,Artificial intelligence,San Francisco,United States,North America,2018,$603M,"  $603,000,000  ","Accel, Y Combinator, Index Ventures"
Gong,$7B,"  $7,000,000,000  ",12/08/2020,Artificial intelligence,Palo Alto,United States,North America,2015,$583M,"  $583,000,000  ","Norwest Venture Partners, Next World Capital, Wing Venture Capital"
TripActions,$7B,"  $7,000,000,000  ",08/11/2018,Travel,Palo Alto,United States,North America,2015,$912M,"  $912,000,000  ","Andreessen Horowitz, Lightspeed Venture Partners, Zeev Ventures"
1Password,$7B,"  $7,000,000,000  ",08/07/2021,Cybersecurity,Toronto,Canada,North America,2005,$920M,"  $920,000,000  ","Slack Fund, Accel, Skip Capital"
Automation Anywhere,$7B,"  $7,000,000,000  ",02/07/2018,Artificial intelligence,San Jose,United States,North America,2003,$849M,"  $849,000,000  ","General Atlantic, Goldman Sachs, New Enterprise Associates"
Gemini,$7B,"  $7,000,000,000  ",19/11/2021,Fintech,New York,United States,North America,2015,$424M,"  $424,000,000  ","Morgan Creek Digital, Marcy Venture Partners, 10T Fund"
ConsenSys,$7B,"  $7,000,000,000  ",17/11/2021,Fintech,New York,United States,North America,2014,$660M,"  $660,000,000  ","Third Point, Electric Capital, Coinbase Ventures"
Ro,$7B,"  $7,000,000,000  ",27/07/2020,Health,New York,United States,North America,2017,$1B,"  $1,000,000,000  ","Initialized Capital, General Catalyst, SignalFire"
Black Unicorn Factory,$6B,"  $6,000,000,000  ",20/05/2021,Other,Los Angeles,United States,North America,2020,$645M,"  $645,000,000  ",Barter Ventures
Easyhome,$6B,"  $6,000,000,000  ",12/02/2018,Consumer & retail,Beijing,China,Asia,1999,$2B,"  $2,000,000,000  ","Alibaba Group, Boyu Capital, Borui Capital"
WeDoctor,$6B,"  $6,000,000,000  ",22/09/2015,Health,Hangzhou,China,Asia,2010,$1B,"  $1,000,000,000  ","Tencent, Morningside Group"
SVOLT,$6B,"  $6,000,000,000  ",08/06/2020,Auto & transportation,Changzhou,China,Asia,2018,$3B,"  $3,000,000,000  ","IDG Capital, Bank Of China Group Investment,, SDIC CMC Investment Management"
Airwallex,$6B,"  $6,000,000,000  ",25/03/2019,Fintech,Melbourne,Australia,Oceania,2015,$802M,"  $802,000,000  ","DST Global, Sequoia Capital China, Tencent Holdings"
Deel,$6B,"  $6,000,000,000  ",21/04/2021,Fintech,San Francisco,United States,North America,2018,$629M,"  $629,000,000  ","Andreessen Horowitz, Spark Capital, Y Combinator"
Mambu,$6B,"  $6,000,000,000  ",06/01/2021,Fintech,Amsterdam,Netherlands,Europe,2011,$448M,"  $448,000,000  ","Runa Capital, Acton Capital Partners, Point Nine Capital"
Mollie,$6B,"  $6,000,000,000  ",08/09/2020,Fintech,Amsterdam,Netherlands,Europe,2004,$928M,"  $928,000,000  ",Technology Crossover Ventures
Doctolib,$6B,"  $6,000,000,000  ",19/03/2019,Health,Paris,France,Europe,2013,$815M,"  $815,000,000  ","BPI France, Kerala Ventures, Accel"
FiveTran,$6B,"  $6,000,000,000  ",30/06/2020,Data management & analytics,Oakland,United States,North America,2012,$728M,"  $728,000,000  ","Matrix Partners, Andreessen Horowitz, General Catalyst"
Postman,$6B,"  $6,000,000,000  ",11/06/2020,Internet software & services,San Francisco,United States,North America,2014,$433M,"  $433,000,000  ","Nexus Venture Partners, CRV, Insight Partners"
Back Market,$6B,"  $6,000,000,000  ",18/05/2021,E-commerce & direct-to-consumer,Paris,France,Europe,2014,$1B,"  $1,000,000,000  ","Aglae Ventures, Eurazeo, Daphni"
Cityblock Health,$6B,"  $6,000,000,000  ",10/12/2020,Health,Brooklyn,United States,North America,2017,$891M,"  $891,000,000  ","Thrive Capital, Maverick Ventures, Redpoint Ventures"
DataRobot,$6B,"  $6,000,000,000  ",29/07/2019,Artificial intelligence,Boston,United States,North America,2012,$1B,"  $1,000,000,000  ","New Enterprise Associates, Accomplice, IA Ventures"
Personio,$6B,"  $6,000,000,000  ",19/01/2021,Internet software & services,Munich,Germany,Europe,2015,$524M,"  $524,000,000  ","Global Founders Capital, Nortzone Ventures, Picus Capital"
RELEX Solutions,$6B,"  $6,000,000,000  ",17/02/2022,"Supply chain, logistics, & delivery",Helsinki,Finland,Europe,2005,$803M,"  $803,000,000  ","Blackstone, Technology Crossover Ventures, Summit Partners"
Vice Media,$6B,"  $6,000,000,000  ",02/04/2011,Internet software & services,Brooklyn,United States,North America,1994,$1B,"  $1,000,000,000  ","Technology Crossover Ventures, A&E Television Networks"
Workato,$6B,"  $6,000,000,000  ",12/01/2021,Internet software & services,Mountain View,United States,North America,2013,$415M,"  $415,000,000  ","Battery Ventures, Storm Ventures, Redpoint Ventures"
Upgrade,$6B,"  $6,000,000,000  ",12/02/2018,Fintech,San Francisco,United States,North America,2016,$587M,"  $587,000,000  ","Union Square Ventures, Ribbit Capital, VY Capital"
Lianjia,$6B,"  $6,000,000,000  ",07/04/2016,E-commerce & direct-to-consumer,Beijing,China,Asia,2001,$1B,"  $1,000,000,000  ","Tencent, Baidu, Huasheng Capital"
Hinge Health,$6B,"  $6,000,000,000  ",06/01/2021,Health,San Francisco,United States,North America,2015,$826M,"  $826,000,000  ","Atomico, Insight Partners, Coatue Management"
Lyra Health,$6B,"  $6,000,000,000  ",25/08/2020,Health,Burlingame,United States,North America,2015,$910M,"  $910,000,000  ","Greylock Partners, Venrock, Providence Ventures"
Benchling,$6B,"  $6,000,000,000  ",14/04/2021,Internet software & services,San Francisco,United States,North America,2012,$412M,"  $412,000,000  ","Thrive Capital, Benchmark, MenloVentures"
Better.com,$6B,"  $6,000,000,000  ",10/11/2020,Fintech,New York,United States,North America,2018,$405M,"  $405,000,000  ","Pine Brook, American Express Ventures, Kleiner Perkins Caufield & Byers"
iCapital Network,$6B,"  $6,000,000,000  ",27/07/2021,Fintech,New York,United States,North America,2013,$729M,"  $729,000,000  ","BlackRock, Blackstone, UBS"
Wiz,$6B,"  $6,000,000,000  ",17/03/2021,Cybersecurity,Tel Aviv,Israel,Asia,2020,$600M,"  $600,000,000  ","Insight Partners, Sequoia Capital, Index Ventures"
DailyHunt,$5B,"  $5,000,000,000  ",22/12/2020,Internet software & services,Bengaluru,India,Asia,2007,$869M,"  $869,000,000  ","Falcon Edge Capital, Omidyar Network, Sequoia Capital India"
Howden Group Holdings,$5B,"  $5,000,000,000  ",29/09/2020,Other,London,United Kingdom,Europe,1994,$187M,"  $187,000,000  ","General Atlantic, 3i Group, Huagai Capital"
Meesho,$5B,"  $5,000,000,000  ",05/04/2021,Internet software & services,Bengaluru,India,Asia,2015,$1B,"  $1,000,000,000  ","Venture Highway, Sequoia Capital India, Prosus Ventures"
Meizu Technology,$5B,"  $5,000,000,000  ",23/07/2014,Hardware,Zhuhai,China,Asia,2003,$943M,"  $943,000,000  ","Telling Telecommunication Holding Co., Alibaba Group"
CloudWalk Technology,$5B,"  $5,000,000,000  ",08/10/2018,Artificial intelligence,Guangzhou,China,Asia,2015,$514M,"  $514,000,000  ","Oriza Holdings, Guangdong Technology Financial Group"
Royole Corporation,$5B,"  $5,000,000,000  ",18/08/2015,Hardware,Shenzhen,China,Asia,2012,$492M,"  $492,000,000  ","Warmsun Holding, IDG Capital Partners"
Monzo,$5B,"  $5,000,000,000  ",31/10/2018,Fintech,London,United Kingdom,Europe,2015,$1B,"  $1,000,000,000  ","Passion Capital, Thrive Capital, Orange Digital Ventures"
Socure,$5B,"  $5,000,000,000  ",16/03/2021,Cybersecurity,New York,United States,North America,2012,$644M,"  $644,000,000  ","Two Sigma Ventures, Flint Capital, Commerce Ventures"
VIPKid,$5B,"  $5,000,000,000  ",04/08/2016,Edtech,Beijing,China,Asia,2013,$1B,"  $1,000,000,000  ","Sequoia Capital China, Tencent Holdings, Sinovation Ventures"
Vinted,$5B,"  $5,000,000,000  ",27/11/2019,E-commerce & direct-to-consumer,Vilnius,Lithuania,Europe,2008,$562M,"  $562,000,000  ","Accel, Insight Partners, Burda Principal Investments"
Lendable,$5B,"  $5,000,000,000  ",31/03/2021,Fintech,London,United Kingdom,Europe,2014,$286M,"  $286,000,000  ","Ontario Teachers' Pension Plan, Goldman Sachs"
UBTECH Robotics,$5B,"  $5,000,000,000  ",25/07/2016,Hardware,Shenzhen,China,Asia,2012,$943M,"  $943,000,000  ","CDH Investments, Goldstone Investments, Qiming Venture Partners"
Anduril,$5B,"  $5,000,000,000  ",11/09/2019,Artificial intelligence,Irvine,United States,North America,2017,$691M,"  $691,000,000  ","Andreessen Horowitz, Founders Fund, Revolution Ventures"
Checkr,$5B,"  $5,000,000,000  ",19/09/2019,Internet software & services,San Francisco,United States,North America,2014,$559M,"  $559,000,000  ","Y Combinator, Accel, T. Rowe Price"
